Condition,Body System,Asanas,Pranayama,Mantra (Sanskrit),Mantra (Translit),Deity,Chakra,Notes
Menstrual Cramps,"Reproductive, Muscular","Supta Baddha Konasana, Apanasana, Balasana","Sheetali, Bhramari","ॐ ऐं क्लीं सौः","Om Aim Kleem Sauh","Shakti / Lalita Tripura Sundari","Swadhisthana","Relaxation and cooling; gentle pelvic release."
Irregular Periods / Hormonal Imbalance,"Reproductive, Endocrine","Bhujangasana, Dhanurasana, Setu Bandhasana","Anulom Vilom, Nadi Shodhana","ॐ श्रीं ह्रीं क्लीं चामुण्डायै विच्चे","Om Shreem Hreem Kleem Chamundayai Vichche","Durga / Chamunda","Swadhisthana, Manipura","Regulate hormones, especially adrenal and ovarian glands."
Infertility (Female),"Reproductive, Endocrine","Baddha Konasana, Viparita Karani, Supta Vajrasana","Nadi Shodhana, Ujjayi","ॐ श्रीं बागलामुखी नमः","Om Shreem Baglamukhi Namah","Baglamukhi / Shakti","Swadhisthana","Support ovulation and endometrial lining health."
Infertility (Male),"Reproductive, Endocrine","Virasana, Setu Bandhasana, Ardha Matsyendrasana","Anulom Vilom, Bhramari","ॐ वीर्याय नमः","Om Veeryaya Namah","Agni / Vishnu","Swadhisthana","Improve testosterone, vitality, and sperm health."
PCOS / PCOD,"Reproductive, Endocrine, Metabolic","Malasana, Ustrasana, Bhujangasana","Bhastrika, Nadi Shodhana","ॐ दुं दुर्गायै नमः","Om Dum Durgayai Namah","Durga","Swadhisthana, Manipura","Balances insulin and ovary function; improves pelvic blood flow."
Pelvic Inflammation / Congestion,"Reproductive, Lymphatic","Apanasana, Setu Bandhasana, Viparita Karani","Chandra Bhedana, Diaphragmatic Breath","ॐ सोमाय नमः","Om Somaya Namah","Soma (Moon God)","Swadhisthana","Encourages lymph drainage and reduces stagnation."
Sexual Trauma / Energy Blockage,"Reproductive, Nervous, Emotional","Supta Baddha Konasana, Balasana, Supported Bridge","Bhramari, Nadi Shodhana","ॐ ह्रीं हनुमते नमः","Om Hreem Hanumate Namah","Hanuman","Swadhisthana","Trauma-sensitive approach; restore safety and empowerment."
Loss of Libido,"Reproductive, Endocrine, Emotional","Dhanurasana, Ustrasana, Bhujangasana","Bhastrika, Ujjayi","ॐ क्लीं कामदेवाय नमः","Om Kleem Kamadevaya Namah","Kamadeva","Swadhisthana",
